{"artifacts":[{"allowed_influence":["INTERVENTION","TARGET"],"artifact_id":"artifact:0b59d0c962df13802562","byte_sha256":"3c81d5b3706dc4fd262d2cf11a8f29c706993c0036820e1da53e4f9c66324e2e","phase":"history","role":"HISTORICAL_REPAIR","semantic_sha256":"3c81d5b3706dc4fd262d2cf11a8f29c706993c0036820e1da53e4f9c66324e2e","size_bytes":492,"snapshot_path":"external_source/snapshots/apache_polaris/history/issue_comments.json","source_path":"github_api/issue_comments.json","source_ref":"apache/polaris#4992"},{"allowed_influence":["AUTHORITY","INTERVENTION"],"artifact_id":"artifact:0c484a11b8d4ec906875","byte_sha256":"3746aa344ea1138aa1cebffab86c0859ab6f4691e2e2533d3a9792822771504b","phase":"pre","role":"SOURCE_SEMANTICS","semantic_sha256":"3746aa344ea1138aa1cebffab86c0859ab6f4691e2e2533d3a9792822771504b","size_bytes":6631,"snapshot_path":"external_source/snapshots/apache_polaris/pre/extensions/auth/opa/src/main/java/org/apache/polaris/extension/auth/opa/OpaAuthorizationConfig.java","source_path":"extensions/auth/opa/src/main/java/org/apache/polaris/extension/auth/opa/OpaAuthorizationConfig.java","source_ref":"68cba2027e97683cfe62502cc2982c93e74e53e6"},{"allowed_influence":["FIDELITY","NATIVE_CASE","TARGET"],"artifact_id":"artifact:0e530eed98e1f3ad9d2f","byte_sha256":"a2814d578f60a5d4e1e7a12c8c9b2e4f693c52b2dca24956b526fa66501bd90b","phase":"post","role":"NATIVE_TEST","semantic_sha256":"a2814d578f60a5d4e1e7a12c8c9b2e4f693c52b2dca24956b526fa66501bd90b","size_bytes":12616,"snapshot_path":"external_source/snapshots/apache_polaris/post/extensions/auth/opa/src/test/java/org/apache/polaris/extension/auth/opa/OpaPolarisAuthorizerFactoryTest.java","source_path":"extensions/auth/opa/src/test/java/org/apache/polaris/extension/auth/opa/OpaPolarisAuthorizerFactoryTest.java","source_ref":"d0a8dff401e30cab1df3ca6d0e133816e80e9c10"},{"allowed_influence":["CONTROLLER_OBS","REPRESENTATION_INTERFACE"],"artifact_id":"artifact:1818eb44031f5dc4719f","byte_sha256":"9af35b9ad0cd7fe7b8d22dc38d721a7c330178881c8b96df5dc6d1270bd9ec77","phase":"pre","role":"SOURCE_SEMANTICS","semantic_sha256":"9af35b9ad0cd7fe7b8d22dc38d721a7c330178881c8b96df5dc6d1270bd9ec77","size_bytes":2060,"snapshot_path":"external_source/snapshots/apache_polaris/pre/extensions/auth/opa/opa-input-schema.json","source_path":"extensions/auth/opa/opa-input-schema.json","source_ref":"68cba2027e97683cfe62502cc2982c93e74e53e6"},{"allowed_influence":["INTERVENTION","REPRESENTATION_INTERFACE"],"artifact_id":"artifact:2ef9d4704ba1b42378a7","byte_sha256":"684ca8fcd93a44b3297aea8e391439cbdcf073eb03ade19067e68ab19bdfd8b6","phase":"post","role":"HISTORICAL_REPAIR","semantic_sha256":"684ca8fcd93a44b3297aea8e391439cbdcf073eb03ade19067e68ab19bdfd8b6","size_bytes":1885,"snapshot_path":"external_source/snapshots/apache_polaris/post/extensions/auth/opa/src/main/java/org/apache/polaris/extension/auth/opa/model/Context.java","source_path":"extensions/auth/opa/src/main/java/org/apache/polaris/extension/auth/opa/model/Context.java","source_ref":"d0a8dff401e30cab1df3ca6d0e133816e80e9c10"},{"allowed_influence":["FIDELITY","NATIVE_CASE","TARGET"],"artifact_id":"artifact:349921bab3faee979455","byte_sha256":"47be84e3cbf91aa5b9d5027b2833a300bfe260defdcdd5d449541696a2322b29","phase":"post","role":"NATIVE_TEST","semantic_sha256":"47be84e3cbf91aa5b9d5027b2833a300bfe260defdcdd5d449541696a2322b29","size_bytes":52268,"snapshot_path":"external_source/snapshots/apache_polaris/post/extensions/auth/opa/src/test/java/org/apache/polaris/extension/auth/opa/OpaPolarisAuthorizerTest.java","source_path":"extensions/auth/opa/src/test/java/org/apache/polaris/extension/auth/opa/OpaPolarisAuthorizerTest.java","source_ref":"d0a8dff401e30cab1df3ca6d0e133816e80e9c10"},{"allowed_influence":["INTERVENTION","TARGET"],"artifact_id":"artifact:360de0be5aabeb76b355","byte_sha256":"a4fc70c7b1b91a897ec14ff198d36f38d425bfd0762c33eeee1eb7b05dec697f","phase":"history","role":"HISTORICAL_REPAIR","semantic_sha256":"a4fc70c7b1b91a897ec14ff198d36f38d425bfd0762c33eeee1eb7b05dec697f","size_bytes":5897,"snapshot_path":"external_source/snapshots/apache_polaris/history/review_comments.json","source_path":"github_api/review_comments.json","source_ref":"apache/polaris#4992"},{"allowed_influence":["INTERVENTION","TARGET"],"artifact_id":"artifact:3b9168154787cc539e6a","byte_sha256":"15500d6549aebb120f30a62e4f885cde3ceed7254237883f9fb4ff401abd0166","phase":"post","role":"HISTORICAL_REPAIR","semantic_sha256":"15500d6549aebb120f30a62e4f885cde3ceed7254237883f9fb4ff401abd0166","size_bytes":34101,"snapshot_path":"external_source/snapshots/apache_polaris/post/CHANGELOG.md","source_path":"CHANGELOG.md","source_ref":"d0a8dff401e30cab1df3ca6d0e133816e80e9c10"},{"allowed_influence":["REPRESENTATION_INTERFACE"],"artifact_id":"artifact:4f390ae247cb149b7abe","byte_sha256":"a983f665a2a65508f1ccd2c884fe79bede34b805c1a3e9a87da13d0ed0c65b8f","phase":"pre","role":"SOURCE_SEMANTICS","semantic_sha256":"a983f665a2a65508f1ccd2c884fe79bede34b805c1a3e9a87da13d0ed0c65b8f","size_bytes":1600,"snapshot_path":"external_source/snapshots/apache_polaris/pre/extensions/auth/opa/src/main/java/org/apache/polaris/extension/auth/opa/model/Context.java","source_path":"extensions/auth/opa/src/main/java/org/apache/polaris/extension/auth/opa/model/Context.java","source_ref":"68cba2027e97683cfe62502cc2982c93e74e53e6"},{"allowed_influence":["AUTHORITY","CONTROLLER_OBS","INTERVENTION"],"artifact_id":"artifact:58d0f6c1b1baa90dceb5","byte_sha256":"9aba5b3f6d27fc4dd0a1a3fc9edeaac88b7bb52e47ade11195c31ea5c5a6cc5a","phase":"pre","role":"SOURCE_SEMANTICS","semantic_sha256":"9aba5b3f6d27fc4dd0a1a3fc9edeaac88b7bb52e47ade11195c31ea5c5a6cc5a","size_bytes":7168,"snapshot_path":"external_source/snapshots/apache_polaris/pre/extensions/auth/opa/src/main/java/org/apache/polaris/extension/auth/opa/OpaPolarisAuthorizerFactory.java","source_path":"extensions/auth/opa/src/main/java/org/apache/polaris/extension/auth/opa/OpaPolarisAuthorizerFactory.java","source_ref":"68cba2027e97683cfe62502cc2982c93e74e53e6"},{"allowed_influence":["ROUTE_EXCLUSION"],"artifact_id":"artifact:60459e8eccc6acd55ee6","byte_sha256":"a4e021a27e8fb99c4bc7cb3c66bb46b24393e10586d6a15bcebff7be46dd0731","phase":"pre","role":"EXCLUDED","semantic_sha256":"a4e021a27e8fb99c4bc7cb3c66bb46b24393e10586d6a15bcebff7be46dd0731","size_bytes":1505,"snapshot_path":"external_source/snapshots/apache_polaris/pre/runtime/service/src/main/java/org/apache/polaris/service/auth/DefaultPolarisAuthorizerFactory.java","source_path":"runtime/service/src/main/java/org/apache/polaris/service/auth/DefaultPolarisAuthorizerFactory.java","source_ref":"68cba2027e97683cfe62502cc2982c93e74e53e6"},{"allowed_influence":["HISTORY","TARGET"],"artifact_id":"artifact:765bd07bca2879bb3eef","byte_sha256":"385f7480ba4c6b57da01a8e66bbafeb55df214718292a8170589b4f9d9ace84e","phase":"pre","role":"NATIVE_TARGET","semantic_sha256":"385f7480ba4c6b57da01a8e66bbafeb55df214718292a8170589b4f9d9ace84e","size_bytes":2601,"snapshot_path":"external_source/snapshots/apache_polaris/pre/site/content/in-dev/unreleased/realm.md","source_path":"site/content/in-dev/unreleased/realm.md","source_ref":"68cba2027e97683cfe62502cc2982c93e74e53e6"},{"allowed_influence":["INTERVENTION","TARGET"],"artifact_id":"artifact:7b98a32cb4ec015c730f","byte_sha256":"3dd3b42db34b652363d696275250832070ef9a13637e7d0ffa3489d8d1fde886","phase":"history","role":"HISTORICAL_REPAIR","semantic_sha256":"3dd3b42db34b652363d696275250832070ef9a13637e7d0ffa3489d8d1fde886","size_bytes":1654,"snapshot_path":"external_source/snapshots/apache_polaris/history/files.json","source_path":"github_api/files.json","source_ref":"apache/polaris#4992"},{"allowed_influence":["INTERVENTION","TARGET"],"artifact_id":"artifact:7bcdf0bbc7451b9af21b","byte_sha256":"21725c6ebcfbaf62d5aa5660ccf410b48bd36e8f4538afda4367994ebef355cf","phase":"history","role":"HISTORICAL_REPAIR","semantic_sha256":"21725c6ebcfbaf62d5aa5660ccf410b48bd36e8f4538afda4367994ebef355cf","size_bytes":1949,"snapshot_path":"external_source/snapshots/apache_polaris/history/reviews.json","source_path":"github_api/reviews.json","source_ref":"apache/polaris#4992"},{"allowed_influence":["INTERVENTION","TARGET"],"artifact_id":"artifact:849b81356b83490b91e7","byte_sha256":"d03b54f565b5b0490da7edcf22807cd6ead490165487d66229455a6b2408038a","phase":"history","role":"HISTORICAL_REPAIR","semantic_sha256":"d03b54f565b5b0490da7edcf22807cd6ead490165487d66229455a6b2408038a","size_bytes":1434,"snapshot_path":"external_source/snapshots/apache_polaris/history/commits.json","source_path":"github_api/commits.json","source_ref":"apache/polaris#4992"},{"allowed_influence":["AUTHORITY","TARGET","TERMINAL"],"artifact_id":"artifact:911252956e9611e9606b","byte_sha256":"0b029c74da37bdb09cfdd06e66e07718c877ff0f45a5a609c9410b068bbf1cfe","phase":"pre","role":"NATIVE_TARGET","semantic_sha256":"0b029c74da37bdb09cfdd06e66e07718c877ff0f45a5a609c9410b068bbf1cfe","size_bytes":15337,"snapshot_path":"external_source/snapshots/apache_polaris/pre/site/content/in-dev/unreleased/managing-security/external-pdp/opa.md","source_path":"site/content/in-dev/unreleased/managing-security/external-pdp/opa.md","source_ref":"68cba2027e97683cfe62502cc2982c93e74e53e6"},{"allowed_influence":["CONTROLLER_OBS","REPRESENTATION_INTERFACE"],"artifact_id":"artifact:98afd169fbb99d63989a","byte_sha256":"a178fc37e2eb9da33b3f65cb3c2ee2de2d81b526582938289b3d892bc11276fd","phase":"post","role":"SOURCE_SEMANTICS","semantic_sha256":"a178fc37e2eb9da33b3f65cb3c2ee2de2d81b526582938289b3d892bc11276fd","size_bytes":2148,"snapshot_path":"external_source/snapshots/apache_polaris/post/extensions/auth/opa/opa-input-schema.json","source_path":"extensions/auth/opa/opa-input-schema.json","source_ref":"d0a8dff401e30cab1df3ca6d0e133816e80e9c10"},{"allowed_influence":["REPRESENTATION_INTERFACE","TARGET"],"artifact_id":"artifact:9a6dcd81b2ca6e434f01","byte_sha256":"b9654cbd8c178f60b2d80facea4b7556ff84f1ec18a01181fd33fc56421a44f1","phase":"post","role":"SOURCE_SEMANTICS","semantic